{
  "schema_version": "1.0.0",
  "catalog_id": "cap-constraints",
  "terminology_note": "The supplied document calls this product a JNET1 Gateway or Group Controller, not a CAP. CAP is retained only as the project-domain label.",
  "product": {
    "manufacturer": { "value": "Juganu", "unit": null, "status": "manufacturer_specification", "source": { "file": "Input/CAP/CAP datasheet.pdf", "page": 1, "section": "Document header/footer", "field_or_topic": "Juganu identity" }, "confidence": "high", "notes": "Manufacturer shown on every page." },
    "product_name": { "value": "JNET1 Gateway (Group Controller)", "unit": null, "status": "manufacturer_specification", "source": { "file": "Input/CAP/CAP datasheet.pdf", "page": 1, "section": "Title and introduction", "field_or_topic": "Product name" }, "confidence": "high", "notes": "Datasheet terminology." },
    "model": { "value": "JGW-JNET1", "unit": null, "status": "manufacturer_specification", "source": { "file": "Input/CAP/CAP datasheet.pdf", "page": 5, "section": "Ordering Information", "field_or_topic": "Product" }, "confidence": "high", "notes": "Base ordering model; band and enclosure suffixes select variants." },
    "hardware_version": { "value": null, "unit": null, "status": "unknown", "source": { "file": null, "page": null, "section": null, "field_or_topic": "Hardware version" }, "confidence": "none", "notes": "No hardware revision is identified." },
    "document_revision": { "value": "1.2", "unit": null, "status": "manufacturer_specification", "source": { "file": "Input/CAP/CAP datasheet.pdf", "page": 1, "section": "Footer", "field_or_topic": "Rev" }, "confidence": "high", "notes": "Document revision, not a hardware version." },
    "intended_function": { "value": "Point of presence bridging the JNET1 wireless network to the IP domain and aggregating bidirectional subtree-node data for the Lighting Management System", "unit": null, "status": "manufacturer_specification", "source": { "file": "Input/CAP/CAP datasheet.pdf", "page": 1, "section": "Introduction", "field_or_topic": "Gateway function" }, "confidence": "high", "notes": "Engineering summary of explicit datasheet text." },
    "ordering_variants": { "value": ["JGW-JNET1-915-ID", "JGW-JNET1-433-ID", "JGW-JNET1-915-CEL-OD", "JGW-JNET1-433-CEL-OD"], "unit": null, "status": "manufacturer_specification", "source": { "file": "Input/CAP/CAP datasheet.pdf", "page": 5, "section": "Ordering Information", "field_or_topic": "Model / Description" }, "confidence": "high", "notes": "Indoor 433/915 MHz and outdoor cellular 433/915 MHz variants." }
  },
  "constraints": {
    "manufacturer_specifications": [
      { "id": "max_nodes_per_gateway", "category": "capacity", "value": 1000, "unit": "node", "status": "manufacturer_specification", "source": { "file": "Input/CAP/CAP datasheet.pdf", "page": 2, "section": "Network Connectivity", "field_or_topic": "Nodes per gateway" }, "confidence": "high", "notes": "Repeated on pages 1 and 4. This is a stated maximum, not a recommended design load." },
      { "id": "maximum_open_air_coverage", "category": "range", "value": 10, "unit": "km", "status": "manufacturer_specification", "source": { "file": "Input/CAP/CAP datasheet.pdf", "page": 1, "section": "Features", "field_or_topic": "Covers up to 10 km in open air" }, "confidence": "medium", "notes": "Marketing maximum with no propagation, antenna, height, or reliability conditions; not a recommended operating distance." },
      { "id": "maximum_dense_urban_coverage", "category": "range", "value": 8, "unit": "km", "status": "manufacturer_specification", "source": { "file": "Input/CAP/CAP datasheet.pdf", "page": 1, "section": "Features", "field_or_topic": "Covers up to 8 km in dense urban areas" }, "confidence": "medium", "notes": "Marketing maximum with no engineering conditions; not a recommendation constraint." },
      { "id": "frequency_band_433", "category": "radio", "value": { "min": 433.05, "max": 434.79 }, "unit": "MHz", "status": "manufacturer_specification", "source": { "file": "Input/CAP/CAP datasheet.pdf", "page": 2, "section": "Communication", "field_or_topic": "Frequency ranges" }, "confidence": "high", "notes": "Availability and legality are region dependent." },
      { "id": "frequency_band_902", "category": "radio", "value": { "min": 902, "max": 928 }, "unit": "MHz", "status": "manufacturer_specification", "source": { "file": "Input/CAP/CAP datasheet.pdf", "page": 2, "section": "Communication", "field_or_topic": "Frequency ranges" }, "confidence": "high", "notes": "Page 4 summarizes this family as 915 MHz." },
      { "id": "data_rate_433", "category": "performance", "value": 100, "unit": "kbps", "status": "manufacturer_specification", "source": { "file": "Input/CAP/CAP datasheet.pdf", "page": 2, "section": "Communication", "field_or_topic": "Data rate @ 433 MHz" }, "confidence": "high", "notes": "Raw wireless data rate, not application throughput." },
      { "id": "data_rate_900", "category": "performance", "value": 500, "unit": "kbps", "status": "manufacturer_specification", "source": { "file": "Input/CAP/CAP datasheet.pdf", "page": 2, "section": "Communication", "field_or_topic": "Data rate @ 900 MHz" }, "confidence": "high", "notes": "Page 4 labels the band 915 MHz." },
      { "id": "gateway_goodput_433", "category": "performance", "value": 40, "unit": "kbps", "status": "manufacturer_specification", "source": { "file": "Input/CAP/CAP datasheet.pdf", "page": 4, "section": "JNET1 Gateway/Network characteristics", "field_or_topic": "GW aggregate goodput @ 433 MHz" }, "confidence": "high", "notes": "Aggregate goodput stated separately from radio bandwidth." },
      { "id": "gateway_goodput_915", "category": "performance", "value": 200, "unit": "kbps", "status": "manufacturer_specification", "source": { "file": "Input/CAP/CAP datasheet.pdf", "page": 4, "section": "JNET1 Gateway/Network characteristics", "field_or_topic": "GW aggregate goodput @ 915 MHz" }, "confidence": "high", "notes": "Aggregate goodput stated separately from radio bandwidth." },
      { "id": "transmitter_output_max", "category": "radio", "value": 10, "unit": "dBm", "status": "manufacturer_specification", "source": { "file": "Input/CAP/CAP datasheet.pdf", "page": 2, "section": "Communication", "field_or_topic": "Transmitter output" }, "confidence": "high", "notes": "Maximum stated output." },
      { "id": "receiver_sensitivity", "category": "radio", "value": -95, "unit": "dBm", "status": "manufacturer_specification", "source": { "file": "Input/CAP/CAP datasheet.pdf", "page": 2, "section": "Communication", "field_or_topic": "Receiver sensitivity" }, "confidence": "high", "notes": "Specified at 200 kbps and 1% packet error rate." },
      { "id": "maximum_hops", "category": "mesh", "value": 64, "unit": "hop", "status": "manufacturer_specification", "source": { "file": "Input/CAP/CAP datasheet.pdf", "page": 4, "section": "JNET1 Gateway/Network characteristics", "field_or_topic": "Maximum number of hops" }, "confidence": "high", "notes": "Protocol maximum, not a recommended design target." },
      { "id": "maximum_children_per_parent", "category": "mesh", "value": 16, "unit": "node", "status": "manufacturer_specification", "source": { "file": "Input/CAP/CAP datasheet.pdf", "page": 4, "section": "JNET1 Gateway/Network characteristics", "field_or_topic": "Maximum children per parent" }, "confidence": "high", "notes": "Explicit tree branching maximum." },
      { "id": "hop_propagation_delay", "category": "performance", "value": { "min": 60, "max": 300 }, "unit": "ms/hop", "status": "manufacturer_specification", "source": { "file": "Input/CAP/CAP datasheet.pdf", "page": 4, "section": "JNET1 Gateway/Network characteristics", "field_or_topic": "Hop propagation delay (min/max)" }, "confidence": "high", "notes": "Per-hop range stated by the manufacturer." },
      { "id": "routing_topology", "category": "topology", "value": "source_routing_tree", "unit": null, "status": "manufacturer_specification", "source": { "file": "Input/CAP/CAP datasheet.pdf", "page": 2, "section": "Network Connectivity", "field_or_topic": "Routing topology" }, "confidence": "high", "notes": "Network grows through parent-child JNET1 cells as described on page 4." },
      { "id": "backhaul_indoor", "category": "backhaul", "value": "wired IPv4 over RJ45 Ethernet", "unit": null, "status": "manufacturer_specification", "source": { "file": "Input/CAP/CAP datasheet.pdf", "page": 4, "section": "JNET1 Network Theory of Operation", "field_or_topic": "Gateway to LMS link for indoor installations" }, "confidence": "high", "notes": "IPv6 is stated as available upon request on page 2." },
      { "id": "backhaul_outdoor", "category": "backhaul", "value": "cellular broadband modem/network", "unit": null, "status": "manufacturer_specification", "source": { "file": "Input/CAP/CAP datasheet.pdf", "page": 4, "section": "JNET1 Network Theory of Operation", "field_or_topic": "Gateway to LMS link for outdoor installations" }, "confidence": "high", "notes": "Outdoor ordering variants include CEL." },
      { "id": "power_supply_indoor", "category": "power", "value": { "voltage": 5, "current": 0.5 }, "unit": "VDC/A", "status": "manufacturer_specification", "source": { "file": "Input/CAP/CAP datasheet.pdf", "page": 2, "section": "Electrical", "field_or_topic": "Power supply - Indoor gateway" }, "confidence": "high", "notes": "Standard USB power input." },
      { "id": "power_supply_outdoor", "category": "power", "value": { "voltage_min": 100, "voltage_max": 240, "frequency_min": 50, "frequency_max": 60 }, "unit": "VAC/Hz", "status": "manufacturer_specification", "source": { "file": "Input/CAP/CAP datasheet.pdf", "page": 2, "section": "Electrical", "field_or_topic": "Power supply - Outdoor gateway" }, "confidence": "high", "notes": "Via ANSI C136.41 7-pin connector with stated 10 kV protection." },